{
  "schemaVersion": 1,
  "compiler": {
    "name": "CrossGL-Compiler",
    "version": "0.1.0",
    "llvmVersion": "unknown"
  },
  "module": "SourceFreeNativeFixture",
  "target": "metal",
  "sourceHash": {
    "algorithm": "sha256",
    "value": "c0b5df7fb74ceef746570777efdfdfa48f1bc21077c21d6fea75c09c0b3268e0"
  },
  "packageArtifactRequirements": {
    "target": "metal",
    "packageMode": "native",
    "requiredPathArtifacts": [
      "nativeBinary"
    ],
    "requiresNativeBinaryStatus": false,
    "allowsPlannedNativeBinary": false,
    "allowsPlannedNativeSourceEvidence": false,
    "evidenceIds": [
      "target-legalization.v1.metal.package-artifacts.native",
      "target-legalization.v1.metal.package-artifact.required.nativeBinary"
    ]
  },
  "artifacts": {
    "nativeBinary": "backend/metal/SourceFreeNativeFixture.metallib",
    "nativeArtifactDescriptor": "metadata/native-artifact.json"
  }
}
